{
  "schema_version": "1",
  "event_type": "governance_decision",
  "record_id": "rec_f6a1986b8e00",
  "timestamp": "2026-06-01T04:36:39.787222Z",
  "adapter": "mcp",
  "agent_id": "agent-numof-int",
  "tool": "query",
  "action": "warn",
  "reason": "integer out of the RFC 8785 number domain",
  "decision_mode": "deterministic",
  "request_hash": "sha256:9ee20023d2bec36e7443092c34aa8439193f6ad0939187da18ed4cf044391265",
  "decision_hash": "sha256:f6a1986b8e00e033eac4112208eaf0a3398239459d1d72233c59799219da5524",
  "trust_score": 1234567890123456789012345678901234567890123456789012345678901234567890123456789012345678901234567890123456789012345678901234567890123456789012345678901234567890123456789012345678901234567890123456789012345678901234567890123456789012345678901234567890123456789012345678901234567890123456789012345678901234567890123456789012345678901234567890123456789012345678901234567890,
  "trust_state": "TRUSTED"
}
