{
  "schema_version": "1",
  "event_type": "governance_decision",
  "record_id": "rec_81bd0fe976ea",
  "timestamp": "2026-06-01T04:36:39.787222Z",
  "adapter": "mcp",
  "agent_id": "agent-html",
  "tool": "query",
  "action": "deny",
  "reason": "blocked DROP TABLE \u0026 SELECT \u003c 1 \u003e 0",
  "decision_mode": "deterministic",
  "request_hash": "sha256:9ee20023d2bec36e7443092c34aa8439193f6ad0939187da18ed4cf044391265",
  "decision_hash": "sha256:81bd0fe976ea3bfe3d19f521b69c8ce00dd4b65ceadb1453c8645b2388f1aa0f",
  "trust_score": 1,
  "trust_state": "TRUSTED"
}
