{
  "schema_version": "1",
  "event_type": "governance_decision",
  "record_id": "rec_033bea5fa74c",
  "timestamp": "2026-06-01T04:36:39.787222Z",
  "adapter": "mcp",
  "agent_id": "agent-numof",
  "tool": "query",
  "action": "warn",
  "reason": "out-of-range number is unrepresentable in JCS",
  "decision_mode": "deterministic",
  "request_hash": "sha256:9ee20023d2bec36e7443092c34aa8439193f6ad0939187da18ed4cf044391265",
  "decision_hash": "sha256:033bea5fa74c4381940c3c93c6ce4d854c4fa5870a4fe5260e151cf451c3e13d",
  "trust_score": 1e999,
  "trust_state": "TRUSTED"
}
