{
  "schema_version": "1",
  "event_type": "governance_decision",
  "record_id": "rec_da32782017ae",
  "timestamp": "2026-06-01T04:36:39.787222Z",
  "adapter": "cli",
  "agent_id": "agent-warn",
  "tool": "rm",
  "action": "warn",
  "reason": "destructive command flagged for review",
  "decision_mode": "deterministic",
  "request_hash": "sha256:9ee20023d2bec36e7443092c34aa8439193f6ad0939187da18ed4cf044391265",
  "decision_hash": "sha256:da32782017ae39dd2813b21f3be1072a42cd3b3b6af39bcae289dd50de12e46b",
  "trust_score": 0.75,
  "trust_state": "TRUSTED"
}
