{
  "schema_version": "1",
  "event_type": "governance_decision",
  "record_id": "rec_04f26fb888aa",
  "timestamp": "2026-06-01T04:36:39.787222Z",
  "adapter": "mcp",
  "agent_id": "agent-allow",
  "tool": "query",
  "action": "allow",
  "reason": "permitted by default-allow policy",
  "decision_mode": "deterministic",
  "request_hash": "sha256:9ee20023d2bec36e7443092c34aa8439193f6ad0939187da18ed4cf044391265",
  "decision_hash": "sha256:04f26fb888aad12b244ed3350a0e6e5cd0d139e438a401f42d6c88ca230ddfc7",
  "trust_score": 1,
  "trust_state": "TRUSTED"
}
