{
  "schema_version": "1",
  "event_type": "governance_decision",
  "record_id": "rec_bd4c384273bd",
  "timestamp": "2026-06-01T04:36:39.787222Z",
  "adapter": "mcp",
  "agent_id": "agent-inf",
  "tool": "query",
  "action": "warn",
  "reason": "Infinity trust_score is unrepresentable in JCS",
  "decision_mode": "deterministic",
  "request_hash": "sha256:9ee20023d2bec36e7443092c34aa8439193f6ad0939187da18ed4cf044391265",
  "decision_hash": "sha256:bd4c384273bd70c8807a70aa97749bff2909e107637494118836a8acf690b0de",
  "trust_score": Infinity,
  "trust_state": "TRUSTED"
}
