{
  "schema_version": "1",
  "event_type": "governance_decision",
  "record_id": "rec_936292b4eca4",
  "timestamp": "2026-06-01T04:36:39.787222Z",
  "adapter": "mcp",
  "agent_id": "agent-numof-neg",
  "tool": "query",
  "action": "warn",
  "reason": "out-of-range number is unrepresentable in JCS",
  "decision_mode": "deterministic",
  "request_hash": "sha256:9ee20023d2bec36e7443092c34aa8439193f6ad0939187da18ed4cf044391265",
  "decision_hash": "sha256:936292b4eca4943da44883eebd48a36a2ab23a161726a7985a2791c332eaf95c",
  "trust_score": -1e999,
  "trust_state": "TRUSTED"
}
