{
  "schema_version": "1",
  "event_type": "governance_decision",
  "record_id": "rec_1c8fe9a532d0",
  "timestamp": "2026-06-01T04:36:39.787222Z",
  "adapter": "mcp",
  "agent_id": "agent-approval",
  "tool": "deploy.production",
  "action": "require_approval",
  "reason": "production deploy requires approval",
  "decision_mode": "deterministic",
  "request_hash": "sha256:9ee20023d2bec36e7443092c34aa8439193f6ad0939187da18ed4cf044391265",
  "decision_hash": "sha256:1c8fe9a532d0ae2da09526c997b676614a69b7f91690aacc37a2c554cd666364",
  "trust_score": 1,
  "trust_state": "TRUSTED"
}
